{
  "$schema": "https://json-schema.org/draft/2020-12/schema",
  "$id": "https://purposesource.org/spec/schemas/certificate-record.v1.json",
  "title": "Certificate verify record — /certs/{cert_id}.json",
  "description": "The public verify record for one certificate, regenerated on issue and on every status change (FS08-060). This shape is BYTE-AUTHORITATIVE: the public verify route is a passthrough and no consumer may rename or reshape a field — same names (`cid`, `typ`, `variant`), structured `scope`, `band` with no currency prefix (FS08-060a). The record never contains more subject data than the certificate itself displays (CERT-026), individual-subject records are unlisted (unguessable ULID, excluded from every index and sitemap, served `X-Robots-Tag: noindex`, CERT-060), and the route reads this artifact only — never a database (FS08-061).\n\n`ct: null` means signed-but-not-yet-logged, and the verify page renders UNVERIFIED (CERT-030). Clients can independently re-derive inclusion from the published log segments. Erasure leaves a tombstone: `status: \"revoked\"` with the subject fields removed, hash-only log entries retained (CERT-045/031).",
  "x-psn": {
    "specVersion": "1.4.0",
    "phase": "P-M2",
    "artifactPath": "/certs/{cert_id}.json",
    "authoritative": true,
    "producer": "index-build (P-M2: operator script + PR, VS-27)",
    "consumers": ["edge verify route (FS-10 §6)", "web verify page (VS-25, WEB-090)"],
    "fsRefs": ["FS-00 §6.2", "FS-08 §7.1 (FS08-060, FS08-060a)", "FS-10 §6 (FS10-040…FS10-042)", "CERT-024…CERT-045", "D181"],
    "vsRefs": ["VS-04", "VS-25", "VS-27"],
    "changelog": "CHANGELOG.md#certificate-recordv1json"
  },
  "type": "object",
  "additionalProperties": false,
  "required": ["schemaVersion", "generatedAt", "cid", "status", "typ", "variant", "period", "issuedAt", "kid"],
  "properties": {
    "schemaVersion": { "const": 1 },
    "generatedAt": { "type": "string", "format": "date-time" },
    "source": { "enum": ["registry-v0", "sample", "fixture", "platform"], "description": "Which plane produced this artifact. `sample` and `fixture` declare a NON-PRODUCTION plane: every page that renders such an artifact is labelled sample, and a production deployment refuses to serve it (FS-10 §2 v0 note; the edge route answers `sandbox_artifact_on_prod`). `registry-v0` is the P-M2 production source of record — the curated registry repository the index is built from. `platform` is the P-M3 producer of record — the platform database, rendered by `jobs.index-build`. Optional, and its absence asserts nothing: an artifact whose body cannot carry the label borrows the plane's declaration from `/registry/index/meta.json`. The enum widens additively when the P-M3 producer takes a value of its own, and `platform` (2026-09-12) is that widening: `jobs.index-build` writes it in `PSN_ENV=prod` and writes `fixture` in every other environment, so a reader can still tell a production plane from a synthetic one by the label alone." },
    "cid": { "type": "string", "pattern": "^cert_[0-9abcdefghjkmnpqrstvwxyz]{26}$" },
    "status": {
      "enum": ["valid", "expired", "revoked", "superseded"],
      "description": "CERT-040. `expired` is clock-derived from `period.validUntil` and needs no write; expiry is non-destructive and verifies as 'was valid for period P' (CERT-041)."
    },
    "typ": { "enum": ["contributor", "steward", "supporter", "license-status", "topup"], "description": "The frozen certificate type enum (FS-00 §6.4), as the certificate payload carries it. `topup` is reserved: the voluntary multipliers were withdrawn before any sale (ops decision D44 item 7, 2026-09-15), so no top-up certificate is ever issued; the token stays because the type enum is frozen and a published enum value is never removed." },
    "variant": { "enum": ["participation", "registration", "impact", "entitlement", "gift-funder", "waived-funder", "donation", "sponsor", "waiver", "under-threshold", "gifted-pass", "x2", "x5", "x10"] },
    "disclosure": { "enum": ["full", "status-only"], "description": "What this public record discloses (ops decision D44). `full` — the subject's display name, band and compact JWS, as every record carried before D44; an absent member reads as `full`. `status-only` — the record of a corporate certificate whose payer did not ask to be listed (D44), or of a person's certificate whose holder did not choose full display, which is every person's certificate until they do (ops decision D115, plan correction 11): no `sub`, no `band` and no `jws`, and instead `jwsSha256`, the SHA-256 the transparency log already carries, so the holder who shows its own signed certificate can prove this record is its record. A company's status-only record keeps its `scope`; a PERSON's status-only record carries no `scope` either, because the projects a person was credited on identify them as surely as the name would (a project with one contributor names that contributor). A consumer switches on this member and never infers it from a missing field." },
    "sub": { "type": "string", "maxLength": 200, "description": "Display name. ABSENT on a tombstoned record after an erasure request (CERT-045)." },
    "scope": {
      "type": "object",
      "additionalProperties": false,
      "required": ["kind"],
      "properties": {
        "kind": { "enum": ["project", "portfolio", "network", "none"] },
        "repos": { "type": "array", "minItems": 1, "maxItems": 50, "uniqueItems": true, "items": { "$ref": "#/$defs/githubNodeId" } },
        "org": { "$ref": "#/$defs/githubNodeId" }
      }
    },
    "band": { "type": "string", "maxLength": 32, "description": "Corporate types only; no currency prefix." },
    "period": {
      "type": "object",
      "additionalProperties": false,
      "required": ["validFrom", "validUntil"],
      "properties": {
        "validFrom": { "type": "string", "format": "date" },
        "validUntil": { "type": "string", "format": "date" }
      }
    },
    "issuedAt": { "type": "string", "format": "date-time" },
    "kid": { "$ref": "#/$defs/kid" },
    "ct": {
      "type": ["object", "null"],
      "additionalProperties": false,
      "required": ["seq", "segment"],
      "description": "Transparency-log position, computed at publish against the log segments. NULL for a signed-but-unlogged certificate — which the verify page must render as UNVERIFIED, not as a warning (CERT-030, FS10-041).",
      "properties": {
        "seq": { "type": "integer", "minimum": 0 },
        "segment": { "type": "integer", "minimum": 0 }
      }
    },
    "revocation": {
      "type": ["object", "null"],
      "additionalProperties": false,
      "required": ["reasonClass", "at"],
      "description": "Present when `status` is `revoked`. Verify pages render the class LABEL only — no free-text shaming (FS08-064).",
      "properties": {
        "reasonClass": {
          "enum": ["issuance-error", "subject-request", "fraud-misrepresentation", "project-delisting", "waiver-revocation", "key-compromise-reissue"],
          "description": "The published narrow class list (CERT-043)."
        },
        "at": { "type": "string", "format": "date-time" },
        "ctRef": { "$ref": "#/$defs/sha256", "description": "Hash of the revocation log entry, which itself references the original entry's hash (CERT-033)." }
      }
    },
    "supersedes": { "type": ["string", "null"], "pattern": "^cert_[0-9abcdefghjkmnpqrstvwxyz]{26}$" },
    "supersededBy": { "type": ["string", "null"], "pattern": "^cert_[0-9abcdefghjkmnpqrstvwxyz]{26}$" },
    "coverageWindow": {
      "type": "object",
      "additionalProperties": false,
      "description": "For a waiver-derived certificate whose waiver was revoked: the ORIGINAL coverage window is retained alongside the revocation date, because revocation is prospective and the historical window remains true (CERT-042, FS08-066).",
      "properties": {
        "from": { "type": "string", "format": "date-time" },
        "to": { "type": ["string", "null"], "format": "date-time" }
      }
    },
    "verifyUrl": { "type": "string", "format": "uri" },
    "jws": {
      "type": "string",
      "pattern": "^[A-Za-z0-9_-]+\\.[A-Za-z0-9_-]+\\.[A-Za-z0-9_-]+$",
      "description": "The compact JWS — the certificate itself. Present so a client can validate the signature offline against a JWKS copy without a second fetch (CERT-025)."
    },
    "entId": { "type": "string", "pattern": "^ent_[0-9abcdefghjkmnpqrstvwxyz]{26}$", "description": "The Entitlement term this certificate attests, for a payment certificate (D44). The term id is already public on the ledger rows and the signed entitlement record; carrying it here is what lets the covered-organisations list name each term’s certificate without decoding a token." },
    "jwsSha256": { "$ref": "#/$defs/sha256", "description": "Lowercase-hex SHA-256 of the compact JWS, the value the transparency log entry carries (FS08-050). Required on a `status-only` record; optional elsewhere." },
    "volunteer": {
      "const": true,
      "description": "The signed payload's `volunteer` member (`certificate.v1.json` 1.7.0, ops decision D181), copied from it: present exactly when the certificate carries it, on a contributor record and on nothing else. It says the certificate is a certificate for volunteering and carries the volunteer words of its kit, so the verify page names the certificate as its own face does. It is on a full and on a status-only record alike: on a status-only record it names nobody, because that record carries no `sub` and, for a person, no `scope`. It is the holder's own statement, which Purpose Source does not check, and it says nothing about money. It is dropped on an erasure tombstone, with the subject fields (CERT-045). `false` is refused: absence means the contributor words, as on the payload. Added in 1.4.0."
    }
  },
  "allOf": [
    {
      "if": { "properties": { "status": { "const": "revoked" } }, "required": ["status"] },
      "then": { "required": ["revocation"] }
    },
    {
      "$comment": "D44: a status-only record carries no subject name, no band and no token, and carries the token hash; every other record carries the token as before.",
      "if": { "properties": { "disclosure": { "const": "status-only" } }, "required": ["disclosure"] },
      "then": { "required": ["jwsSha256"], "not": { "anyOf": [{ "required": ["sub"] }, { "required": ["band"] }, { "required": ["jws"] }] } },
      "else": { "required": ["jws"] }
    },
    {
      "$comment": "D44: a sponsor is never unlisted (statutes Art. 6b(3): undisclosed support is prohibited).",
      "if": { "properties": { "variant": { "const": "sponsor" } }, "required": ["variant"] },
      "then": { "not": { "properties": { "disclosure": { "const": "status-only" } }, "required": ["disclosure"] } }
    },
    {
      "$comment": "D181: the volunteer member is a contributor certificate's, copied from its signed payload (1.4.0). The rule constrains only the new member.",
      "if": { "required": ["volunteer"] },
      "then": { "properties": { "typ": { "const": "contributor" } }, "required": ["typ"] }
    }
  ],
  "$defs": {
    "kid": { "type": "string", "pattern": "^psn-(dev|prod|sandbox)-[0-9]{4}-[0-9]+$", "description": "Frozen key-id scheme `psn-{env}-{yyyy}-{n}` (FS08-101). A prod route refuses sandbox key material outright (FS08-103)." },
    "sha256": { "type": "string", "pattern": "^[0-9a-f]{64}$" },
    "githubNodeId": { "type": "string", "pattern": "^([A-Za-z0-9_-]{4,128}|MDEwOlJlcG9zaXRvcnk[A-Za-z0-9+/=]{1,96})$", "description": "A GitHub GraphQL node_id, in either of the two forms GitHub has issued: the opaque current form (a repository's is `R_`-prefixed) and the legacy base64 form, whose decoded value begins `010:Repository` and whose `=` padding the first alternative cannot express. Widened 2026-09-08 to admit the second: `registry-v0-record.v1` accepts both, so a record the curated registry accepts is publishable in this artifact. The primary key for repositories and people throughout this contract set (FS-00 §6.1)." }
  }
}
